strategy,round,param,old,new,expectancy_R,trades,win_rate,profit_factor,kept
breakout,0,(init),,,0.2650,343,0.563,1.78,init
breakout,1,base_len,40,30,0.1069,521,0.493,1.28,revert
breakout,1,tightness,0.12,0.1,0.1534,227,0.533,1.44,revert
breakout,1,breakout_buffer,0.005,0.008,0.2639,320,0.566,1.79,revert
breakout,1,vol_mult,1.5,2.0,0.3251,172,0.622,2.10,keep
breakout,1,above_200dma,True,False,0.1936,269,0.550,1.53,revert
breakout,1,stop_pct,0.06,0.05,0.3114,172,0.564,1.85,revert
breakout,1,target_R,3.0,4.0,0.3206,172,0.622,2.09,revert
breakout,1,max_hold,20,30,0.2377,172,0.517,1.60,revert
breakout,1,signal_days,10,15,0.1998,273,0.549,1.55,revert
breakout,2,base_len,40,30,0.1003,287,0.484,1.27,revert
breakout,2,tightness,0.12,0.15,0.0918,187,0.476,1.22,revert
breakout,2,breakout_buffer,0.005,0.003,0.3309,184,0.620,2.11,keep
breakout,2,vol_mult,2.0,1.5,0.2487,361,0.557,1.72,revert
breakout,2,above_200dma,True,False,0.1918,285,0.547,1.52,revert
breakout,2,stop_pct,0.06,0.05,0.3251,184,0.565,1.88,revert
breakout,2,target_R,3.0,4.0,0.3234,184,0.620,2.08,revert
breakout,2,max_hold,20,30,0.2626,184,0.522,1.68,revert
breakout,2,signal_days,10,15,0.2143,286,0.556,1.60,revert
breakout,3,base_len,40,30,0.0794,303,0.472,1.21,revert
breakout,3,tightness,0.12,0.15,0.0965,193,0.472,1.23,revert
breakout,3,breakout_buffer,0.003,0.005,0.3251,172,0.622,2.10,revert
breakout,3,vol_mult,2.0,1.5,0.2487,361,0.557,1.72,revert
breakout,3,above_200dma,True,False,0.1918,285,0.547,1.52,revert
breakout,3,stop_pct,0.06,0.05,0.3251,184,0.565,1.88,revert
breakout,3,target_R,3.0,4.0,0.3234,184,0.620,2.08,revert
breakout,3,max_hold,20,30,0.2626,184,0.522,1.68,revert
breakout,3,signal_days,10,15,0.2143,286,0.556,1.60,revert
undercut,0,(init),,,0.2886,263,0.418,1.50,init
undercut,1,base_len,20,10,0.1841,734,0.358,1.28,revert
undercut,1,tightness,0.08,0.1,0.2180,289,0.374,1.34,revert
undercut,1,undercut_depth,0.015,0.01,0.2297,499,0.397,1.38,revert
undercut,1,above_200dma,True,False,0.0851,508,0.346,1.13,revert
undercut,1,stop_pct,0.04,0.05,0.2264,262,0.420,1.41,revert
undercut,1,target_R,2.5,4.0,0.2916,263,0.373,1.47,keep
undercut,1,max_hold,40,60,0.3043,262,0.344,1.46,keep
undercut,1,signal_days,10,15,0.2976,375,0.339,1.45,revert
undercut,2,base_len,20,10,0.3010,725,0.297,1.42,revert
undercut,2,tightness,0.08,0.1,0.2678,288,0.299,1.38,revert
undercut,2,undercut_depth,0.015,0.01,0.2537,491,0.320,1.37,revert
undercut,2,above_200dma,True,False,0.1468,507,0.284,1.20,revert
undercut,2,stop_pct,0.04,0.06,0.3267,255,0.447,1.60,keep
undercut,2,target_R,4.0,2.5,0.3023,258,0.457,1.56,revert
undercut,2,max_hold,60,30,0.2460,262,0.473,1.52,revert
undercut,2,signal_days,10,15,0.3038,363,0.435,1.56,revert
undercut,3,base_len,20,10,0.2862,697,0.359,1.45,revert
undercut,3,tightness,0.08,0.1,0.2676,284,0.384,1.45,revert
undercut,3,undercut_depth,0.015,0.01,0.2454,482,0.407,1.43,revert
undercut,3,above_200dma,True,False,0.1022,494,0.350,1.16,revert
undercut,3,stop_pct,0.06,0.04,0.3043,262,0.344,1.46,revert
undercut,3,target_R,4.0,2.5,0.3023,258,0.457,1.56,revert
undercut,3,max_hold,60,30,0.2460,262,0.473,1.52,revert
undercut,3,signal_days,10,15,0.3038,363,0.435,1.56,revert
bottom,0,(init),,,0.3268,5840,0.345,1.48,init
bottom,1,base_len,3,2,0.4155,4321,0.369,1.64,keep
bottom,1,tightness,0.12,0.15,0.5205,2211,0.398,1.84,keep
bottom,1,bottom_zone,0.02,0.03,0.4930,2388,0.390,1.79,revert
bottom,1,above_200dma,False,True,-inf,699,0.322,1.34,revert
bottom,1,stop_pct,0.03,0.02,0.5973,2211,0.414,1.97,keep
bottom,1,target_R,3.0,4.0,0.7441,2211,0.364,2.11,keep
bottom,1,max_hold,40,20,0.7687,2211,0.380,2.18,keep
bottom,1,signal_days,10,5,0.7617,2100,0.380,2.17,revert
bottom,2,base_len,2,5,0.5764,3820,0.336,1.83,revert
bottom,2,tightness,0.15,0.12,0.5876,4326,0.340,1.85,revert
bottom,2,bottom_zone,0.02,0.03,0.7302,2388,0.374,2.11,revert
bottom,2,above_200dma,False,True,-inf,699,0.306,1.60,revert
bottom,2,stop_pct,0.02,0.03,0.6189,2207,0.383,1.98,revert
bottom,2,target_R,4.0,3.0,0.6028,2211,0.420,1.99,revert
bottom,2,max_hold,20,60,0.7652,2211,0.364,2.15,revert
bottom,2,signal_days,10,5,0.7617,2100,0.380,2.17,revert
